ticker,title,published,source
AAPL,"Prominent Tech Investor: ‘When We Were Buying Nvidia in 2023, We Were Paying 4 Times Earnings’","Tue, 09 Jun 2026 18:54:30 +0000",
AAPL,Apple shares slip as analysts offer mixed read on WWDC AI progress,"Tue, 09 Jun 2026 18:27:00 +0000",
AAPL,"Micron, Marvell, Super Micro, Coherent, Smucker, and More Stocks That Explain Today’s Market","Tue, 09 Jun 2026 18:25:00 +0000",
AAPL,Equities Markets Fall Intraday Amid Tech Sell-Off,"Tue, 09 Jun 2026 18:17:06 +0000",
AAPL,Palantir vs. Apple: Which Stock Offers More Upside in 2026?,"Tue, 09 Jun 2026 18:13:04 +0000",
AAPL,Where Alphabet Stock Is Most Exposed,"Tue, 09 Jun 2026 17:38:26 +0000",
AAPL,Sector Update: Tech Stocks Fall Tuesday Afternoon,"Tue, 09 Jun 2026 17:32:39 +0000",
AAPL,Why Apple Stock Is Sinking Today,"Tue, 09 Jun 2026 17:18:43 +0000",
AAPL,"Stock Market Today, June 9: Chipmakers Drag Nasdaq Down at Midday","Tue, 09 Jun 2026 17:15:21 +0000",
AAPL,"Stocks slump as US tech rebound falters, oil dips below $90","Tue, 09 Jun 2026 17:07:20 +0000",
AAPL,Nvidia Finally Lands Apple as an AI Customer. What It Means for the Stock.,"Tue, 09 Jun 2026 17:07:00 +0000",
AAPL,"Anthropic Expands Mythos Access After Finding Over 10,000 Serious Vulnerabilities","Tue, 09 Jun 2026 17:02:39 +0000",
AAPL,Roblox Shares Jump 5.37% After Russia Agencies Seek Ban Reversal,"Tue, 09 Jun 2026 17:00:58 +0000",
AAPL,"Anthropic launches Mythos-class Claude Fable 5 model, available to the public","Tue, 09 Jun 2026 17:00:00 +0000",
AAPL,Apple quietly reveals how it plans to make money from AI,"Tue, 09 Jun 2026 16:59:30 +0000",
AAPL,Apple WWDC: Can Rebuilt Siri Finally Prove Two-Year AI Vision Pays Off?,"Tue, 09 Jun 2026 16:56:10 +0000",
AAPL,Apple announces store closures amid major retail problem,"Tue, 09 Jun 2026 16:33:00 +0000",
AAPL,It’s not FAANG anymore. It’s MANGOS.,"Tue, 09 Jun 2026 16:09:14 +0000",
AAPL,Microsoft Stock And The Peril Of Peak Profitability,"Tue, 09 Jun 2026 16:04:19 +0000",
AAPL,Kiddopia Launches Digital Gift Cards on Amazon’s Online Store,"Tue, 09 Jun 2026 16:00:00 +0000",
TSLA,"Prominent Tech Investor: ‘When We Were Buying Nvidia in 2023, We Were Paying 4 Times Earnings’","Tue, 09 Jun 2026 18:54:30 +0000",
TSLA,Electros Inc. Advances Its EV Charging Patent Strategy as It Continues Pursuing Long‑term Growth in Electric Vehicle Technology and Critical Minerals,"Tue, 09 Jun 2026 18:40:00 +0000",
TSLA,SpaceX IPO Turns Tesla Merger Talk Into a Core Wall Street Thesis,"Tue, 09 Jun 2026 18:18:19 +0000",
TSLA,Tesla Wins Denmark Green Light For FSD Expansion — But TSLA Stock Slips,"Tue, 09 Jun 2026 17:54:44 +0000",
TSLA,Elon Musk Reveals Details For SpaceX-Tesla Orbiting Data Center,"Tue, 09 Jun 2026 17:37:19 +0000",
TSLA,"Tesla (TSLA) Rolls Out Unsupervised Robotaxis in ​Austin Metro Area, Reuters Reports","Tue, 09 Jun 2026 17:24:33 +0000",
TSLA,Rivian Launches the R2 to Chase Tesla,"Tue, 09 Jun 2026 17:01:38 +0000",
TSLA,Elon Musk Reacts To $30 Trillion SpaceX Valuation Call: 'Ron Is Smart',"Tue, 09 Jun 2026 16:31:05 +0000",
TSLA,Why Musk's SpaceX control is an 'all-out assault' on US market integrity,"Tue, 09 Jun 2026 16:04:34 +0000",
TSLA,The Model 3 Era at Rivian Begins. Its Lower-Price EV Is Here.,"Tue, 09 Jun 2026 14:56:00 +0000",
TSLA,SpaceX IPO: A Tesla-Like Opportunity or a $1.75 Trillion Trap?,"Tue, 09 Jun 2026 14:48:00 +0000",
TSLA,Solidion Strengthens Battery Moat with 7 New Patents,"Tue, 09 Jun 2026 14:28:33 +0000",
TSLA,Elon Musk Reveals Insane Plan to Double American Chip Production in a Single Plant,"Tue, 09 Jun 2026 14:27:16 +0000",
TSLA,Wall Street sees AI trade bearing fruit with MANGOS ahead of IPOs,"Tue, 09 Jun 2026 14:04:55 +0000",
TSLA,How Dutch Safety Data Could Open Europe for Tesla,"Tue, 09 Jun 2026 13:57:00 +0000",
TSLA,"Tesla Just Lost One of Its Biggest Bears, but Is the Stock a Buy?","Tue, 09 Jun 2026 13:55:00 +0000",
TSLA,"SpaceX, Anthropic, OpenAI Can Rewrite History for Megacap IPOs","Tue, 09 Jun 2026 13:42:01 +0000",
TSLA,Potential implications from SpaceX IPO for Tesla?,"Tue, 09 Jun 2026 13:03:56 +0000",
TSLA,Wall Street Pounds the Table: Tesla’s Future Is Not in Cars — It’s Robotics,"Tue, 09 Jun 2026 13:00:09 +0000",
TSLA,Energy Transition Update - CIP Boosts Energy Transition With Battery Storage Project,"Tue, 09 Jun 2026 11:37:51 +0000",
MSFT,Why Microsoft Stock Is Sinking Today,"Tue, 09 Jun 2026 18:53:24 +0000",
MSFT,Equities Markets Fall Intraday Amid Tech Sell-Off,"Tue, 09 Jun 2026 18:17:06 +0000",
MSFT,Can PLTR Stock Live Up To Its Multiple?,"Tue, 09 Jun 2026 18:14:50 +0000",
MSFT,Barclays Raises Hewlett Packard Enterprise (HPE) Price Target on Sustained Demand Strength,"Tue, 09 Jun 2026 18:12:48 +0000",
MSFT,Where Alphabet Stock Is Most Exposed,"Tue, 09 Jun 2026 17:38:26 +0000",
MSFT,Is NVIDIA (NVDA) One of the Best NASDAQ Stocks to Buy and Hold for 3 Years?,"Tue, 09 Jun 2026 17:23:52 +0000",
MSFT,CoreWeave Founders Have Sold $2.3 Billion in Stock Since IPO,"Tue, 09 Jun 2026 17:03:52 +0000",
MSFT,Microsoft Gets a Fresh AI Cloud Signal,"Tue, 09 Jun 2026 17:00:55 +0000",
MSFT,"Anthropic launches Mythos-class Claude Fable 5 model, available to the public","Tue, 09 Jun 2026 17:00:00 +0000",
MSFT,Microsoft’s $9K Return on $1K Crushes The Market,"Tue, 09 Jun 2026 16:45:04 +0000",
MSFT,"Sam Altman’s OpenAI Confidentially Files for IPO, Eyes $850+ Billion Valuation","Tue, 09 Jun 2026 16:43:05 +0000",
MSFT,"Pax8 to Launch Relationship with inforcer, Expanding Microsoft 365 Security, Governance and Copilot Readiness for MSPs","Tue, 09 Jun 2026 16:20:00 +0000",
MSFT,Rigetti Advances Toward Quantum Advantage With Cepheus Push,"Tue, 09 Jun 2026 16:17:00 +0000",
MSFT,OpenAI’s Paradox: ChatGPT Owner Files for IPO But Wants to Stay Private for ‘A While’,"Tue, 09 Jun 2026 16:06:00 +0000",
MSFT,Microsoft Stock And The Peril Of Peak Profitability,"Tue, 09 Jun 2026 16:04:19 +0000",
MSFT,"Qualcomm Drops 8% on ByteDance ASIC Deal, Marvell Falls 10% as Custom-Silicon Stocks Slide","Tue, 09 Jun 2026 15:47:20 +0000",
MSFT,"The Dividend Strategy That Beats the 4% Rule by $400,000 Over 20 Years on a $1 Million Portfolio","Tue, 09 Jun 2026 15:46:01 +0000",
MSFT,OKTA's Strong Backlog and AI Opportunity Drive Growth: What's Ahead?,"Tue, 09 Jun 2026 15:43:00 +0000",
MSFT,Why Oracle Stock Needs a Successful OpenAI IPO—and Microsoft Doesn’t,"Tue, 09 Jun 2026 15:36:00 +0000",
MSFT,"Western Computer and Microsoft to Host Navigate Forward: Business Central & The AI Advantage Event in Downers Grove, IL","Tue, 09 Jun 2026 15:30:00 +0000",
General,56-year-old beloved fast-food chain closes over 700 locations,2026-06-09T00:55:00Z,TheStreet
General,Is Prudential Financial Stock Underperforming the S&P 500?,2026-06-08T09:55:41Z,Barchart
General,Five ways Elon Musk's SpaceX upended Wall Street's IPO playbook,2026-06-08T10:02:02Z,Reuters
General,Japanese investors make biggest foreign stock exit in five years in May,2026-06-08T09:17:55Z,Reuters
General,How Is Paychex's Stock Performance Compared to Other Software Stocks,2026-06-08T09:09:15Z,Barchart
General,Analyst Report: Humana Inc,2026-06-09T17:41:15Z,Argus Research
General,Gold slides to 11-week low as Fed rate expectations and oil rally pressure bullion,2026-06-08T09:55:47Z,InvestorsHub
General,"How Long Can $900,000 in an IRA Last for a 75-Year-Old Retiree?",2026-06-08T09:00:00Z,SmartAsset
General,Kinder Morgan Stock: Is KMI Underperforming the Energy Sector?,2026-06-08T08:35:34Z,Barchart
General,Stocks reel from a coming rate hike — and brace for a huge IPO: What to watch this week,2026-06-07T11:40:19Z,Yahoo Finance
General,Tigo Energy (TYGO) Delivers US-Made MLPE to EG4 Electronics to Qualify for Domestic Content Tax Credits,2026-06-08T08:26:41Z,Insider Monkey
General,Analyst Report: Enbridge Inc,2026-06-09T17:41:15Z,Argus Research
General,Quantum Blockchain CEO: 'Now we are finally ready and we are generating the data',2026-06-08T09:59:55Z,Proactive
General,Boost Run (BRUN) Debuts on Nasdaq With $940M in Backed Contracted Revenue,2026-06-08T08:26:27Z,Insider Monkey
General,Viasat (VSAT) Selected by Lockheed Martin to Provide Satellite Communications for NOAA’s Hurricane Hunter Aircraft,2026-06-08T08:26:16Z,Insider Monkey
General,Here is Why Velo3D (VELO) One of the Hot Tech Stocks to Buy According to Analysts,2026-06-08T08:26:08Z,Insider Monkey
General,FiEE (FIEE) Grants Restricted Stock Units to Key Partners to Incentivize Long-Term Collaboration,2026-06-08T08:26:35Z,Insider Monkey
General,"Market Update: ENB, AAPL, DVN, HUM",2026-06-09T17:26:15Z,Argus Research
General,DHI Group (DHX): 10 Hot Tech Stocks to Buy According to Analysts,2026-06-08T08:26:00Z,Insider Monkey
General,Silvaco (SVCO) Launches Industry-First MIPI C-PHY/D-PHY Combo IP on TSMC N2P Process,2026-06-08T08:25:37Z,Insider Monkey
General,Is FatPipe (FATN) One of the Hot Tech Stocks to Buy According to Analysts?,2026-06-08T08:25:44Z,Insider Monkey
General,VIAVI Solutions (VIAV) Launches AI Experts Suite to Automate Complex Network Testing Processes,2026-06-08T08:25:52Z,Insider Monkey
General,SOXX Surged 190% in a Year but XSD Only Returned 180% — Here’s Why the Difference Matters,2026-06-08T10:00:46Z,24/7 Wall St.
General,nLIGHT (LASR) Launches HADES High-Energy Laser Effectors for Defense Systems,2026-06-08T08:25:30Z,Insider Monkey
General,Chip rout puts Korea's 'ant' investors to the test as margin debt soars,2026-06-08T08:23:16Z,Reuters
General,Your guide to managing crypto volatility with dollar-cost averaging,2026-06-08T15:03:04Z,Yahoo Personal Finance
General,What does renters insurance cover?,2026-06-08T16:10:57Z,Yahoo Personal Finance
General,How buying groups help independent c-stores compete with major chains,2026-06-08T10:00:00Z,C-Store Dive
General,Platinum forecast and tracker: How will platinum perform in 2026?,2026-06-08T16:52:56Z,Yahoo Personal Finance
General,When will gas prices go down? Brace for 'most volatile summer' in years.,2026-04-14T15:45:06Z,Yahoo Personal Finance
General,Is your student loan repayment plan about to be eliminated? What to know before July 1.,2026-05-04T22:37:37Z,Yahoo Personal Finance
General,Weekly survey of mortgage lenders with the lowest rates: Leaders price in the low 6% range,2025-11-03T17:08:34Z,Yahoo Personal Finance
General,Boston Scientific to build Indiana distribution center,2026-06-08T10:00:00Z,MedTech Dive
General,Digital wallet vs. traditional bank account: Which is best for your money?,2026-06-08T18:20:17Z,Yahoo Personal Finance
General,Can you write checks from a savings account?,2024-06-10T19:04:41Z,Yahoo Personal Finance
General,Amex Blue Cash Everyday vs. Blue Cash Preferred: Two top cards for everyday spending,2024-11-22T23:16:37Z,Yahoo Personal Finance
General,5 ways to tariff-proof your finances,2025-04-23T19:43:17Z,Yahoo Personal Finance
General,Canon USA appoints new senior marketing director for production print,2026-06-08T09:54:15Z,Packaging Gateway
General,Zynlo Bank review (2026): Highly competitive rates with absolutely no fees,2025-07-25T17:56:02Z,Yahoo Personal Finance
General,"Best CD rates today, Tuesday, June 9, 2026: Lock in up to 4% APY today",2026-06-09T10:00:00Z,Yahoo Personal Finance
General,"Best high-yield savings interest rates today, Tuesday, June 9, 2026: Earn up to 4.10% APY",2026-06-09T10:00:00Z,Yahoo Personal Finance
General,"Mortgage and refinance rates today, Tuesday, June 9, 2026: Rates on the rise",2026-06-09T10:00:00Z,Yahoo Personal Finance
General,Daily Spotlight: SpaceX is Coming,2026-06-09T11:24:33Z,Argus Research
General,Oil surges as Israeli strikes on Iran and Lebanon reignite supply concerns,2026-06-08T09:58:57Z,InvestorsHub
General,"Best money market account rates today, Tuesday, June 9, 2026: Earn up to 4.01% APY",2026-06-09T10:00:00Z,Yahoo Personal Finance
